{
  "type": "tool_abuse_signal",
  "ts": "2026-03-24T12:04:00.000Z",
  "schemaVersion": "0.1.0",
  "environment": "development",
  "service": "carapace-playground",
  "actor": {
    "ip": "192.0.2.90",
    "userAgent": "agent-runner/1.0",
    "method": "POST",
    "path": "/v1/tools/run"
  },
  "signal": {
    "toolName": "shell.exec",
    "reason": "Repeated unrestricted shell execution attempts."
  },
  "tags": [
    "tool_abuse"
  ]
}
